{
  "$schema": "https://json-schema.org/draft/2020-12/schema",
  "$id": "https://k-comms.example/schemas/usability-study-v3.json",
  "title": "K-Comms formal usability study evidence",
  "description": "Privacy-preserving structural contract for the 12-session usability study and exact low-click journey receipts for the Inbox, Calls, Directory, Files, and You experience. The score_usability_study.mjs validator is authoritative for cross-field task, action-count, participant, date, and release-gate semantics.",
  "type": "object",
  "additionalProperties": false,
  "required": [
    "schema_version",
    "release_revision",
    "environment",
    "study_started_on",
    "study_completed_on",
    "security_regression",
    "authorization_regression",
    "tenant_isolation_regression",
    "durability_regression",
    "staging_gates_pass",
    "manual_accessibility",
    "accessibility_findings",
    "approver_receipt",
    "action_count_receipts",
    "sessions"
  ],
  "properties": {
    "schema_version": { "const": 3 },
    "release_revision": { "type": "string", "pattern": "^[0-9a-fA-F]{40}$" },
    "environment": { "type": "string", "minLength": 1, "maxLength": 120 },
    "study_started_on": { "type": "string", "format": "date" },
    "study_completed_on": { "type": "string", "format": "date" },
    "security_regression": { "type": "boolean" },
    "authorization_regression": { "type": "boolean" },
    "tenant_isolation_regression": { "type": "boolean" },
    "durability_regression": { "type": "boolean" },
    "staging_gates_pass": { "type": "boolean" },
    "manual_accessibility": { "$ref": "#/$defs/manualAccessibility" },
    "accessibility_findings": {
      "type": "array",
      "items": { "$ref": "#/$defs/accessibilityFinding" }
    },
    "approver_receipt": { "$ref": "#/$defs/approverReceipt" },
    "action_count_receipts": {
      "type": "array",
      "minItems": 15,
      "maxItems": 15,
      "uniqueItems": true,
      "items": { "$ref": "#/$defs/actionCountReceipt" },
      "allOf": [
        { "contains": { "properties": { "id": { "const": "sign-in-inbox" } }, "required": ["id"] }, "minContains": 1, "maxContains": 1 },
        { "contains": { "properties": { "id": { "const": "invite-inbox" } }, "required": ["id"] }, "minContains": 1, "maxContains": 1 },
        { "contains": { "properties": { "id": { "const": "open-unread" } }, "required": ["id"] }, "minContains": 1, "maxContains": 1 },
        { "contains": { "properties": { "id": { "const": "directory-direct" } }, "required": ["id"] }, "minContains": 1, "maxContains": 1 },
        { "contains": { "properties": { "id": { "const": "directory-room" } }, "required": ["id"] }, "minContains": 1, "maxContains": 1 },
        { "contains": { "properties": { "id": { "const": "file-source-return" } }, "required": ["id"] }, "minContains": 1, "maxContains": 1 },
        { "contains": { "properties": { "id": { "const": "call-lobby-join" } }, "required": ["id"] }, "minContains": 1, "maxContains": 1 },
        { "contains": { "properties": { "id": { "const": "active-call-rejoin" } }, "required": ["id"] }, "minContains": 1, "maxContains": 1 },
        { "contains": { "properties": { "id": { "const": "you-profile" } }, "required": ["id"] }, "minContains": 1, "maxContains": 1 },
        { "contains": { "properties": { "id": { "const": "you-devices" } }, "required": ["id"] }, "minContains": 1, "maxContains": 1 },
        { "contains": { "properties": { "id": { "const": "you-notifications" } }, "required": ["id"] }, "minContains": 1, "maxContains": 1 },
        { "contains": { "properties": { "id": { "const": "you-settings" } }, "required": ["id"] }, "minContains": 1, "maxContains": 1 },
        { "contains": { "properties": { "id": { "const": "admin-entry" } }, "required": ["id"] }, "minContains": 1, "maxContains": 1 },
        { "contains": { "properties": { "id": { "const": "ops-entry" } }, "required": ["id"] }, "minContains": 1, "maxContains": 1 },
        { "contains": { "properties": { "id": { "const": "ordinary-recovery" } }, "required": ["id"] }, "minContains": 1, "maxContains": 1 }
      ]
    },
    "sessions": {
      "type": "array",
      "minItems": 12,
      "maxItems": 12,
      "items": {
        "allOf": [
          { "$ref": "#/$defs/session" },
          {
            "oneOf": [
              { "$ref": "#/$defs/memberSession" },
              { "$ref": "#/$defs/adminSession" },
              { "$ref": "#/$defs/moderatorSession" },
              { "$ref": "#/$defs/complianceSession" },
              { "$ref": "#/$defs/operatorSession" }
            ]
          }
        ]
      }
    }
  },
  "$defs": {
    "manualAccessibility": {
      "type": "object",
      "additionalProperties": false,
      "required": ["wcag_2_2_a_aa_status", "assistive_technology_matrix_status", "open_a_aa_failures", "completed_on"],
      "properties": {
        "wcag_2_2_a_aa_status": { "enum": ["not_completed", "passed", "failed"] },
        "assistive_technology_matrix_status": { "enum": ["not_completed", "passed", "failed"] },
        "open_a_aa_failures": { "type": "integer", "minimum": 0 },
        "completed_on": { "type": ["string", "null"], "format": "date" }
      }
    },
    "accessibilityFinding": {
      "type": "object",
      "additionalProperties": false,
      "required": ["finding_id", "standard", "severity", "status"],
      "properties": {
        "finding_id": { "type": "string", "pattern": "^[A-Za-z0-9][A-Za-z0-9_-]*$" },
        "standard": { "enum": ["WCAG 2.2 A", "WCAG 2.2 AA", "advisory"] },
        "severity": { "enum": ["critical", "serious", "moderate", "minor"] },
        "status": { "enum": ["open", "resolved"] }
      }
    },
    "approverReceipt": {
      "type": "object",
      "additionalProperties": false,
      "required": ["status", "approver_role", "approved_on", "evidence_reference"],
      "properties": {
        "status": { "enum": ["not_approved", "approved"] },
        "approver_role": { "const": "release_approver" },
        "approved_on": { "type": ["string", "null"], "format": "date" },
        "evidence_reference": { "type": ["string", "null"], "minLength": 1, "maxLength": 240 }
      }
    },
    "actionCountReceipt": {
      "type": "object",
      "additionalProperties": false,
      "required": [
        "id",
        "participant_id",
        "baseline",
        "performed_on",
        "task_completed",
        "unassisted",
        "action_count",
        "maximum_actions",
        "justified_exception_actions"
      ],
      "properties": {
        "id": {
          "enum": [
            "sign-in-inbox",
            "invite-inbox",
            "open-unread",
            "directory-direct",
            "directory-room",
            "file-source-return",
            "call-lobby-join",
            "active-call-rejoin",
            "you-profile",
            "you-devices",
            "you-notifications",
            "you-settings",
            "admin-entry",
            "ops-entry",
            "ordinary-recovery"
          ]
        },
        "participant_id": { "type": "string", "pattern": "^P[0-9A-Za-z_-]+$" },
        "baseline": { "enum": ["daily_use", "end_to_end"] },
        "performed_on": { "type": "string", "format": "date" },
        "task_completed": { "type": "boolean" },
        "unassisted": { "type": "boolean" },
        "action_count": { "type": "integer", "minimum": 0 },
        "maximum_actions": { "type": "integer", "minimum": 1 },
        "justified_exception_actions": {
          "type": "array",
          "uniqueItems": true,
          "items": { "$ref": "#/$defs/justifiedActionException" }
        },
        "call_safety": { "$ref": "#/$defs/callSafety" }
      },
      "allOf": [
        {
          "if": { "properties": { "id": { "enum": ["sign-in-inbox", "invite-inbox"] } }, "required": ["id"] },
          "then": { "properties": { "baseline": { "const": "end_to_end" } } },
          "else": { "properties": { "baseline": { "const": "daily_use" } } }
        },
        {
          "if": { "properties": { "id": { "enum": ["directory-room", "call-lobby-join"] } }, "required": ["id"] },
          "then": { "properties": { "maximum_actions": { "const": 3 } } },
          "else": {
            "if": {
              "properties": {
                "id": {
                  "enum": [
                    "directory-direct",
                    "file-source-return",
                    "active-call-rejoin",
                    "admin-entry",
                    "ops-entry"
                  ]
                }
              },
              "required": ["id"]
            },
            "then": { "properties": { "maximum_actions": { "const": 2 } } },
            "else": { "properties": { "maximum_actions": { "const": 1 } } }
          }
        },
        {
          "if": { "properties": { "id": { "enum": ["call-lobby-join", "active-call-rejoin"] } }, "required": ["id"] },
          "then": { "required": ["call_safety"] },
          "else": { "not": { "required": ["call_safety"] } }
        },
        {
          "if": { "properties": { "id": { "const": "call-lobby-join" } }, "required": ["id"] },
          "then": {
            "properties": {
              "call_safety": {
                "properties": {
                  "lobby_action_count": { "const": 2 },
                  "join_or_start_action_count": { "const": 1 }
                }
              }
            }
          }
        },
        {
          "if": { "properties": { "id": { "const": "active-call-rejoin" } }, "required": ["id"] },
          "then": {
            "properties": {
              "call_safety": {
                "properties": {
                  "lobby_action_count": { "const": 2 },
                  "join_or_start_action_count": { "const": 0 }
                }
              }
            }
          }
        }
      ]
    },
    "justifiedActionException": {
      "type": "object",
      "additionalProperties": false,
      "required": ["reason", "count"],
      "properties": {
        "reason": {
          "enum": [
            "identity_provider_step",
            "step_up_authentication",
            "reason_entry",
            "destructive_confirmation",
            "media_consent"
          ]
        },
        "count": { "type": "integer", "minimum": 1 }
      }
    },
    "callSafety": {
      "type": "object",
      "additionalProperties": false,
      "required": [
        "microphone_initially_off",
        "camera_initially_off",
        "lobby_observed_before_join",
        "lobby_action_count",
        "join_or_start_action_count"
      ],
      "properties": {
        "microphone_initially_off": { "type": "boolean" },
        "camera_initially_off": { "type": "boolean" },
        "lobby_observed_before_join": { "type": "boolean" },
        "lobby_action_count": { "type": "integer", "minimum": 0 },
        "join_or_start_action_count": { "type": "integer", "minimum": 0 }
      }
    },
    "session": {
      "type": "object",
      "additionalProperties": false,
      "required": [
        "participant_id",
        "cohort",
        "access_method",
        "mobile_first",
        "browser_name",
        "browser_version",
        "viewport_width_css_px",
        "viewport_height_css_px",
        "sus_responses",
        "sensitive_action_confidence",
        "tasks"
      ],
      "properties": {
        "participant_id": { "type": "string", "pattern": "^P[0-9A-Za-z_-]+$" },
        "cohort": { "enum": ["member", "admin", "moderator", "compliance", "operator"] },
        "access_method": { "enum": ["standard", "keyboard", "screen_reader", "zoom_high_contrast", "voice_touch"] },
        "mobile_first": { "type": "boolean" },
        "browser_name": { "type": "string", "minLength": 1, "maxLength": 80 },
        "browser_version": { "type": "string", "minLength": 1, "maxLength": 80 },
        "viewport_width_css_px": { "type": "integer", "minimum": 240, "maximum": 10000 },
        "viewport_height_css_px": { "type": "integer", "minimum": 240, "maximum": 10000 },
        "sus_responses": {
          "type": "array",
          "minItems": 10,
          "maxItems": 10,
          "items": { "type": "integer", "minimum": 1, "maximum": 5 }
        },
        "sensitive_action_confidence": { "type": "integer", "minimum": 1, "maximum": 5 },
        "tasks": {
          "type": "array",
          "uniqueItems": true,
          "items": { "$ref": "#/$defs/task" }
        }
      }
    },
    "task": {
      "type": "object",
      "additionalProperties": false,
      "required": ["id", "category", "critical", "outcome", "duration_seconds", "critical_errors", "backtracks", "facilitator_interventions", "seq", "unintended_destructive_action"],
      "properties": {
        "id": { "enum": ["invite-first-message", "channel-collaboration", "attachment-safety", "history-search", "send-recovery", "notification-control", "device-revocation", "admin-access", "moderation-review", "audit-evidence", "ops-triage"] },
        "category": { "enum": ["invite", "routine", "admin_safety", "ops_safety", "other"] },
        "critical": { "type": "boolean" },
        "outcome": { "enum": ["unassisted", "assisted", "failed"] },
        "duration_seconds": { "type": "number", "minimum": 0 },
        "critical_errors": { "type": "integer", "minimum": 0 },
        "backtracks": { "type": "integer", "minimum": 0 },
        "facilitator_interventions": { "type": "integer", "minimum": 0 },
        "seq": { "type": "number", "minimum": 1, "maximum": 7 },
        "unintended_destructive_action": { "type": "boolean" }
      },
      "allOf": [
        { "if": { "properties": { "id": { "const": "invite-first-message" } }, "required": ["id"] }, "then": { "properties": { "category": { "const": "invite" }, "critical": { "const": true } } } },
        { "if": { "properties": { "id": { "enum": ["channel-collaboration", "attachment-safety", "history-search", "send-recovery"] } }, "required": ["id"] }, "then": { "properties": { "category": { "const": "routine" }, "critical": { "const": true } } } },
        { "if": { "properties": { "id": { "const": "notification-control" } }, "required": ["id"] }, "then": { "properties": { "category": { "const": "other" }, "critical": { "const": false } } } },
        { "if": { "properties": { "id": { "const": "device-revocation" } }, "required": ["id"] }, "then": { "properties": { "category": { "const": "other" }, "critical": { "const": true } } } },
        { "if": { "properties": { "id": { "enum": ["admin-access", "moderation-review"] } }, "required": ["id"] }, "then": { "properties": { "category": { "const": "admin_safety" }, "critical": { "const": true } } } },
        { "if": { "properties": { "id": { "const": "audit-evidence" } }, "required": ["id"] }, "then": { "properties": { "category": { "const": "admin_safety" }, "critical": { "const": false } } } },
        { "if": { "properties": { "id": { "const": "ops-triage" } }, "required": ["id"] }, "then": { "properties": { "category": { "const": "ops_safety" }, "critical": { "const": true } } } },
        { "if": { "properties": { "outcome": { "const": "unassisted" } }, "required": ["outcome"] }, "then": { "properties": { "critical_errors": { "const": 0 }, "facilitator_interventions": { "const": 0 } } } },
        { "if": { "properties": { "outcome": { "const": "assisted" } }, "required": ["outcome"] }, "then": { "properties": { "facilitator_interventions": { "minimum": 1 } } } }
      ]
    },
    "memberSession": {
      "properties": {
        "cohort": { "const": "member" },
        "tasks": {
          "minItems": 7,
          "maxItems": 7,
          "allOf": [
            { "contains": { "properties": { "id": { "const": "invite-first-message" } }, "required": ["id"] } },
            { "contains": { "properties": { "id": { "const": "channel-collaboration" } }, "required": ["id"] } },
            { "contains": { "properties": { "id": { "const": "attachment-safety" } }, "required": ["id"] } },
            { "contains": { "properties": { "id": { "const": "history-search" } }, "required": ["id"] } },
            { "contains": { "properties": { "id": { "const": "send-recovery" } }, "required": ["id"] } },
            { "contains": { "properties": { "id": { "const": "notification-control" } }, "required": ["id"] } },
            { "contains": { "properties": { "id": { "const": "device-revocation" } }, "required": ["id"] } }
          ]
        }
      }
    },
    "adminSession": { "$ref": "#/$defs/singleTaskAdmin" },
    "moderatorSession": {
      "properties": {
        "cohort": { "const": "moderator" },
        "tasks": { "minItems": 1, "maxItems": 1, "contains": { "properties": { "id": { "const": "moderation-review" } }, "required": ["id"] } }
      }
    },
    "complianceSession": {
      "properties": {
        "cohort": { "const": "compliance" },
        "tasks": { "minItems": 1, "maxItems": 1, "contains": { "properties": { "id": { "const": "audit-evidence" } }, "required": ["id"] } }
      }
    },
    "operatorSession": {
      "properties": {
        "cohort": { "const": "operator" },
        "tasks": { "minItems": 1, "maxItems": 1, "contains": { "properties": { "id": { "const": "ops-triage" } }, "required": ["id"] } }
      }
    },
    "singleTaskAdmin": {
      "properties": {
        "cohort": { "const": "admin" },
        "tasks": { "minItems": 1, "maxItems": 1, "contains": { "properties": { "id": { "const": "admin-access" } }, "required": ["id"] } }
      }
    }
  }
}
