{
  "schema_version": 3,
  "release_revision": "REPLACE_WITH_FULL_GIT_SHA",
  "environment": "internal-staging",
  "study_started_on": "YYYY-MM-DD",
  "study_completed_on": "YYYY-MM-DD",
  "security_regression": false,
  "authorization_regression": false,
  "tenant_isolation_regression": false,
  "durability_regression": false,
  "staging_gates_pass": false,
  "manual_accessibility": {
    "wcag_2_2_a_aa_status": "not_completed",
    "assistive_technology_matrix_status": "not_completed",
    "open_a_aa_failures": 0,
    "completed_on": null
  },
  "accessibility_findings": [],
  "approver_receipt": {
    "status": "not_approved",
    "approver_role": "release_approver",
    "approved_on": null,
    "evidence_reference": null
  },
  "action_count_receipts": [
    {
      "id": "sign-in-inbox",
      "participant_id": "P01",
      "baseline": "end_to_end",
      "performed_on": "YYYY-MM-DD",
      "task_completed": false,
      "unassisted": false,
      "action_count": 0,
      "maximum_actions": 1,
      "justified_exception_actions": []
    },
    {
      "id": "invite-inbox",
      "participant_id": "P01",
      "baseline": "end_to_end",
      "performed_on": "YYYY-MM-DD",
      "task_completed": false,
      "unassisted": false,
      "action_count": 0,
      "maximum_actions": 1,
      "justified_exception_actions": []
    },
    {
      "id": "open-unread",
      "participant_id": "P01",
      "baseline": "daily_use",
      "performed_on": "YYYY-MM-DD",
      "task_completed": false,
      "unassisted": false,
      "action_count": 0,
      "maximum_actions": 1,
      "justified_exception_actions": []
    },
    {
      "id": "directory-direct",
      "participant_id": "P01",
      "baseline": "daily_use",
      "performed_on": "YYYY-MM-DD",
      "task_completed": false,
      "unassisted": false,
      "action_count": 0,
      "maximum_actions": 2,
      "justified_exception_actions": []
    },
    {
      "id": "directory-room",
      "participant_id": "P01",
      "baseline": "daily_use",
      "performed_on": "YYYY-MM-DD",
      "task_completed": false,
      "unassisted": false,
      "action_count": 0,
      "maximum_actions": 3,
      "justified_exception_actions": []
    },
    {
      "id": "file-source-return",
      "participant_id": "P01",
      "baseline": "daily_use",
      "performed_on": "YYYY-MM-DD",
      "task_completed": false,
      "unassisted": false,
      "action_count": 0,
      "maximum_actions": 2,
      "justified_exception_actions": []
    },
    {
      "id": "call-lobby-join",
      "participant_id": "P01",
      "baseline": "daily_use",
      "performed_on": "YYYY-MM-DD",
      "task_completed": false,
      "unassisted": false,
      "action_count": 3,
      "maximum_actions": 3,
      "justified_exception_actions": [],
      "call_safety": {
        "microphone_initially_off": false,
        "camera_initially_off": false,
        "lobby_observed_before_join": false,
        "lobby_action_count": 2,
        "join_or_start_action_count": 1
      }
    },
    {
      "id": "active-call-rejoin",
      "participant_id": "P01",
      "baseline": "daily_use",
      "performed_on": "YYYY-MM-DD",
      "task_completed": false,
      "unassisted": false,
      "action_count": 2,
      "maximum_actions": 2,
      "justified_exception_actions": [],
      "call_safety": {
        "microphone_initially_off": false,
        "camera_initially_off": false,
        "lobby_observed_before_join": false,
        "lobby_action_count": 2,
        "join_or_start_action_count": 0
      }
    },
    {
      "id": "you-profile",
      "participant_id": "P01",
      "baseline": "daily_use",
      "performed_on": "YYYY-MM-DD",
      "task_completed": false,
      "unassisted": false,
      "action_count": 0,
      "maximum_actions": 1,
      "justified_exception_actions": []
    },
    {
      "id": "you-devices",
      "participant_id": "P01",
      "baseline": "daily_use",
      "performed_on": "YYYY-MM-DD",
      "task_completed": false,
      "unassisted": false,
      "action_count": 0,
      "maximum_actions": 1,
      "justified_exception_actions": []
    },
    {
      "id": "you-notifications",
      "participant_id": "P01",
      "baseline": "daily_use",
      "performed_on": "YYYY-MM-DD",
      "task_completed": false,
      "unassisted": false,
      "action_count": 0,
      "maximum_actions": 1,
      "justified_exception_actions": []
    },
    {
      "id": "you-settings",
      "participant_id": "P01",
      "baseline": "daily_use",
      "performed_on": "YYYY-MM-DD",
      "task_completed": false,
      "unassisted": false,
      "action_count": 0,
      "maximum_actions": 1,
      "justified_exception_actions": []
    },
    {
      "id": "admin-entry",
      "participant_id": "P07",
      "baseline": "daily_use",
      "performed_on": "YYYY-MM-DD",
      "task_completed": false,
      "unassisted": false,
      "action_count": 0,
      "maximum_actions": 2,
      "justified_exception_actions": []
    },
    {
      "id": "ops-entry",
      "participant_id": "P10",
      "baseline": "daily_use",
      "performed_on": "YYYY-MM-DD",
      "task_completed": false,
      "unassisted": false,
      "action_count": 0,
      "maximum_actions": 2,
      "justified_exception_actions": []
    },
    {
      "id": "ordinary-recovery",
      "participant_id": "P01",
      "baseline": "daily_use",
      "performed_on": "YYYY-MM-DD",
      "task_completed": false,
      "unassisted": false,
      "action_count": 0,
      "maximum_actions": 1,
      "justified_exception_actions": []
    }
  ],
  "sessions": [
    {
      "participant_id": "P01",
      "cohort": "member",
      "access_method": "keyboard",
      "mobile_first": true,
      "browser_name": "REPLACE_WITH_BROWSER",
      "browser_version": "REPLACE_WITH_VERSION",
      "viewport_width_css_px": 390,
      "viewport_height_css_px": 844,
      "sus_responses": [1, 1, 1, 1, 1, 1, 1, 1, 1, 1],
      "sensitive_action_confidence": 1,
      "tasks": [
        {
          "id": "invite-first-message",
          "category": "invite",
          "critical": true,
          "outcome": "failed",
          "duration_seconds": 0,
          "critical_errors": 0,
          "backtracks": 0,
          "facilitator_interventions": 0,
          "seq": 1,
          "unintended_destructive_action": false
        },
        {
          "id": "channel-collaboration",
          "category": "routine",
          "critical": true,
          "outcome": "failed",
          "duration_seconds": 0,
          "critical_errors": 0,
          "backtracks": 0,
          "facilitator_interventions": 0,
          "seq": 1,
          "unintended_destructive_action": false
        },
        {
          "id": "attachment-safety",
          "category": "routine",
          "critical": true,
          "outcome": "failed",
          "duration_seconds": 0,
          "critical_errors": 0,
          "backtracks": 0,
          "facilitator_interventions": 0,
          "seq": 1,
          "unintended_destructive_action": false
        },
        {
          "id": "history-search",
          "category": "routine",
          "critical": true,
          "outcome": "failed",
          "duration_seconds": 0,
          "critical_errors": 0,
          "backtracks": 0,
          "facilitator_interventions": 0,
          "seq": 1,
          "unintended_destructive_action": false
        },
        {
          "id": "send-recovery",
          "category": "routine",
          "critical": true,
          "outcome": "failed",
          "duration_seconds": 0,
          "critical_errors": 0,
          "backtracks": 0,
          "facilitator_interventions": 0,
          "seq": 1,
          "unintended_destructive_action": false
        },
        {
          "id": "notification-control",
          "category": "other",
          "critical": false,
          "outcome": "failed",
          "duration_seconds": 0,
          "critical_errors": 0,
          "backtracks": 0,
          "facilitator_interventions": 0,
          "seq": 1,
          "unintended_destructive_action": false
        },
        {
          "id": "device-revocation",
          "category": "other",
          "critical": true,
          "outcome": "failed",
          "duration_seconds": 0,
          "critical_errors": 0,
          "backtracks": 0,
          "facilitator_interventions": 0,
          "seq": 1,
          "unintended_destructive_action": false
        }
      ]
    }
  ]
}
